私はタイのバンコクに住んでいます。でも生まれは同じく東北です。,タイにお住まいなんですか！そして東北のご出身なんですね！タイは今は気温どのくらいなんですか？,,,
私はただ冗談を言っているだけです,やっぱり、冗談だったのですね。,そうですか。,冗談だったのですか？,あなた、ジョークを言うよりコンピュータをいじくる方が得意みたいね！
私はタンですね。カルビはちょっと苦手かもしれません。,タンもいいですよね、今週の金曜日に行きますよ。タン屋に。,,,
私はチーズケーキが大好きです。お好きなスイーツはありますか？,私もチーズケーキがケーキの中で1番好きです。美味しいですよね！,,,
私はチーズケーキとチョコケーキが好きです。何がお好きですか？何ケーキを買われていたんですか,チーズケーキはヒキタのゴルゴンチーズケーキ，チョコケーキはジャンポールエヴァンお勧めです。私はモンブランが好きです。,,,
私はできるだけ多く大根を入れたいです。,おいしいですし、体にもいいですから一石二鳥ですよね。そちらは何かはまっているものはあるんですか？,,,
私はテレビというとドラマかタモリ倶楽部ですね。,ドラマは家族にチャンネル権を取られています。,,,
私はドームへ行ったことはないですが、テレビで観るのとは迫力が違うのでしょうね。,そうですね、応援の音はテレビでは伝わりませんが、実際はすごいですね。,,,
私はどこも悪くなくて、元気に過ごしています。,いいですね、元気が一番です。,,
私はとても元気です,元気なことは、良いことです。,それは良かったわ。,私も元気です。
私はとても忙しいです,あまり、無理なさらないでくださいネ。,そうですか。,忙しいのですか？
私はドラクエウォークにはまっています。,少し画面を見た事がある程度ですが、ドラクエもとても面白そうですよね。,,
私はとりあえずコーヒーとバナナです。何を食べましたか？,トーストでした。バナナですか。私も１０年ぐらい前はバナナと水でしたよ。,,
私はなにも。通勤時に大きい駅を通りますが，そこで仮装した人を見るくらいですね。,最近は仮装する人多いですよね,,
私はパクチーを食べるまで青臭いものは逆に好きだと思っていたんですが、初めて食べて衝撃を受けましたね。,あれはなんていうか、「青臭い」とかいうものを超えてますよね。好きな人は本当に好きだし、私たちみたいに合わない人にはとことん合わないです。,,
私ははじめしゃちょーさんのチャンネルをTVで見ながらやってます。とりあえず運動をする癖をつけないとと思って。,わたしもやってみようかな。でも家ではダラダラしちゃうんですよね、,,
私はハッピーエンドが好きではないので、だいぶ古いですけど、振り返れば奴がいるが好きでした。,ハッピーエンドがお好きでないんですね。そのドラマは知りません、どういう話なんですか？,,
私はひかりテレビで見ています,そういう時代ですよね、レンタルショップとか厳しそうですよね。,,
私はひかりテレビを使っているのですが、少し古めの映画ばかり見ています。,いいですね。どんなジャンルの映画を見ているんですか。,,
私はビュッフェとかは、いろいろなものを楽しむ場所だと思い、量は気にせず楽しく食べることにしています。でないときついですね。,貧乏性なのでついつい全品取ってしまいます。,,
私はフットサルとジムに行っています。最近はダンベルばかりやっています。みるみる筋肉がつきますよ！,筋トレも面白いらしいですね。筋肉つくのが目に見えてわかると友達が言っていました。,,
私はフラをやっています。,ハワイアンダンスですよね？,,
私はプレミアム商品券で、1万5千円浮きました。,おお、買い物上手ですね。,,
私はホタテが好きです。イカやタコなども好きですよ。,貝類もいいですね。寿司はやっぱり熱いお茶と一緒に食べますか。それともお酒ですか。,,
私はほとんど引きこもり状態で、このパソコンで聞いてます。,パソコンにスピーカーをつけているんですか？,,,
私はほとんど影響なかったですね。,そうですか。私も影響はなかったです。映画はどんなのが好きですか？,,,
私はホラーやサスペンスが大好きです。,どんなサスペンスですか？,,,
私はホラーやサスペンスが特に好きです。,サスペンスでいうと私はヒッチコックを昔見て衝撃を受けました。白黒でしたが。,,,
私はまあまあでしたけど、トビイロウンカの被害がひどかったようです。,初めて聞きます、お米につく害虫ですか？,,,
私はマスクして寝ています。乾燥すると喉がびりびりするので。,マスクも効果ありますよね。あとは私は暖房よりもストーブ派です。上にやかんがおけるやつ。,私もマスクをして寝ていますよ。あとタオルを首に巻くぐらいです。,,
私はまだたくさんすることがあります,あまり、無理なさらないでくださいネ。,そうですか。,することが何か聞いてもよろしいですか？,
私はまだです。小腹が減ってお菓子とか食べちゃってます。,お菓子食べちゃいますよね、この時間。私もラーメン前に食べてしまいました。,,,
私はまだ海外に行ったことがないのですが、イタリアに行ってみたいです。,私もイタリア行ったことないけど、行ってみたいです。ヨーロッパいいですよね。,,,
私はまだ決めていません,決めないのも決定の一つですよ。,そうですか。,ゆっくり考えて決めて下さい。,その話、後でも良いかしら？私がおばあちゃんになってからでも？
私はまだ準備ができていません,準備はしっかりしないとね。,そうですか。,ゆっくり準備しても良いのですよ。,その話、後でも良いかしら？私がおばあちゃんになってからでも？
私はミーハーなのでエヴァンゲリオンやまどかマギカは見てました。,おー。エヴァは見たことがありますが、まどかマギカは見たことないですね。面白いですか？,,,
私はミンチにしてお団子にしたり、あとはチーズと一緒に焼いたりしてましたね。,私もそうしていました。糖質制限は確かに痩せますが、元気も出ないですよね,,,
私はもうコート着てますが、喉が痛いです。,風邪ですか？明日からはコートを着ようと思います。でも電車の中に半そでの人がいて驚きました。,,,
私はもっぱら飲み食いで楽しんでいますが楽しいですよ。普段球場に応援に行ったりとかもされますか？,甲子園が近いので、夏の高校野球はふらっと行きます。球場で飲むビールは格別ですね。,,,
私はもともとあまり食べないほうですが、断食を成功させる自信はないですね。かなりの意思が必要なのでは。,私は美味しいものを食べるのが人生の楽しみなので決意するの大変でした。タイミングは仕事が忙しい時の方がやりやすいです。暇だと食べてしまうので、！,,,
私はモンブランが好きですけど，今日はバスクチーズケーキとティラミスとチョコタルトにしました。,バスクチーズケーキ、気になっていました。おいしそうですよね
私はラグビーはニュースしか見ていませんが、何か好きな選手はいますか？,リーチマイケル選手ですね。
私はラグビーはまったく見ていないのですよ。まわりには試合を見に行く人もいるのですが。,そうなんですか。スポーツは興味ないですか?
私はランチに行った後百貨店でケーキを買いました。ヘアカットはおなじみの店があるんですか？,ええ。いつも行っているところで、１０年ぐらいになりますかね。ケーキですが、どんなケーキですか？
私はリサーチパネルとドコモポイント、楽天ポイントです。案件数が多いのでおすすめですよ。,おすすめなのわかります。全部登録しています！楽天はポイントスクリーンが簡単にポイントが貰えて嬉しいですね！
私はわりと都会に住んでいるので徒歩5分圏内にコンビニ5軒，スーパー3軒あるので便利です。ファミマは1つ。,わりとって、大都会じゃないんですか？
私は愛猫の写真を撮ることです。あとは家庭菜園もやってます。,そうですか、私も猫は大好きです。種類は何ですか？
私は一人分を作るのが面倒な時によく冷凍パスタを買います。,そうですね。ソースや具材も準備しなくて済むのは楽ですものね。
私は運動嫌いなのでサイクリングとかしないなぁ。花より団子です。普段から運動されるんですか？,一週間に一回くらいはストレス解消も兼ねてランニングかサイクリングしてますね。
私は映画はあまり見ないのですが、最近何か話題作など見られましたか？,夏に子どもとライオンキングの実写版を観たぐらいです。
私は映画を見るのが趣味です。,映画館で見たりしますか？私は昨日ターミネーター2を見ました。もう何回も見ましたが。
私は映画館には行かず旧作を見ることが多いのですが最近は「パージ」や「海底47ｍ」を見ました。,レンタルですか？それともオンライン配信ですか？
私は沖縄が一番好きです。行ったことはありますか？,沖縄、まだ行ったことがないんです。
私は音楽を聴くことです。アイコスってなんですか？,加熱式のタバコのことです。賃貸なのでアイコスにしたんですが、けっこう美味しいです、音楽は何を聞きますか
私は化粧水や美容液などスキンケア商品が多いですね。試供品のように使っています。,新製品を先取りできる感じもお得感が良さそうですね。
私は仮装とかしないけど，会社帰りに成城石井でかぼちゃプレミアムチーズケーキを買って，メゾンカイザーでおばけケーキを買いました。,いいですねぇ！ちゃんとハロウィン楽しんでるではないですか！成城石井とはまた高級な！
私は家でYoutube観てなんちゃってダンスをするくらいです。ヨガを１時間しっかりやると汗だくですか？,私もやってた時ありました！ズンバとか見てました。今やってるヨガはハードめなので、汗だくです、が、本当は楽な位置を見つけながらやるんだそうです。奥深いです。,,,
私は家に帰る必要があります,では、さようなら。,そうですか。,お気をつけて。,
私は家族と来ました,家族を大事にしてくださいね。,そうですか。,何人家族ですか？,
私は家庭菜園が趣味なので、だいたい菜園で土いじりをしてますね。,良いですね。どんな野菜を育てていますか？,,,
私は家庭菜園が趣味なんですが、今日はいい天気なので育ててる大根を抜こうと思ってるんです。,おお、それはすごい！大根の他には何か栽培されてるんですか？,,,
私は家庭菜園とガーデニングが趣味なので晴れの日は土いじりしてます。雨の日は飼い猫と遊んでることがおおいですね。,飼い猫さんうらやましいです。私は実家にいます。猫がいる生活羨ましいです、家庭菜園は何を育てていますか,,,
私は家庭菜園と飼い猫を愛でることが趣味です。,猫ちゃん飼ってるんですね！種類はなんですか？,,,
私は花より団子。目的地になにかおいしいものがないと頑張れないなー。,いいですね。よく行く喫茶店でも秋フェアでさつまいものタルトなど出してくれてるのでついつい食べてしまいます。,,,
私は花粉症も鼻炎もありませんが、最近花粉症はいきなりかかるんだよっと言われて毎年びくびくしてます。,あ、まだデビュー前でしたか。本当にいきなり来るらしいですよ。NHKの人ぐらいいきなり来るとか来ないとか,,,
私は海外ドラマにはまってます。,いいですね。テレビですか？それともネットフリックスとかですか？,,,
私は海外ドラマを見て過ごすことが多いです。,おすすめの海外ドラマはありますか？,,,
私は海外ドラマを見ることですかね。,海外ドラマですか。どんな作品を見られているんですか？,,,
私は海外に住んでいるので気候は温かいですが、空気が悪くて体調が芳しくありません。,気候が温かい時期なんですね。日本は、もうインフルエンザ流行していますよ。,,,
私は覚えています,忘れることも必要かもしれませんね。,そうですか。,何を覚えているのですか？,その話、後でも良いかしら？私がおばあちゃんになってからでも？
私は楽天で3000円ぐらいで買いました。あとは牛乳1リットルあれば。,結構な量作れるんですね。それだけあれば料理にも使えそうですね。,,,
私は寒いのが苦手なので羨ましいです。,寒いのはやっぱり嫌ですけど、夏よりかはましです。,,,
私は逆に食べる機会が少ないから必死になるのかもしれません。マラソンとか大丈夫なのか心配になります！,食べる機会に恵まれれば必死になるしかないですね。札幌も十分暑くなるので、あまり意味がない気がします。,,,
私は逆に日本に帰りたいですよ！,是非是非帰国された際は、美味しい日本料理を食べてください！,,,
私は筋トレのせいで腰痛になったようです。お気を付けください。,あぁそういうパターンも有るのですね、・。取り返しの付かないことにならないように気をつけて取り組みます。,,,
私は九州ですが、去年マイナス8℃を経験しました。,九州でそんなに寒いことがあるんですね。一時期長崎にしましたが、そういえばすごく雪が降ったことがありました。,,,
私は九州限定で、くじゅう、阿蘇、霧島、雲仙です。,くじゅうってツツジ？のところでしょうか？,,,
私は軽度なのですが夫が重症です、鼻がつまるとしんどいですよね。,眠れなくなっちゃいますものね。最近は春だけじゃなく年中何かしら反応してる気がします。,,,
私は結婚しています,結婚に関する名言と格言は、たくさんあるようですね。,そうですか。,お相手は、どんな方ですか？,その話、後でも良いかしら？私がおばあちゃんになってからでも？
私は結婚していません,結婚だけが人生ではないかもしれません。,そうですか。,結婚はしたいですか？,その話、後でも良いかしら？私がおばあちゃんになってからでも？
私は月曜日にやってしまいましたよ、ストレスによるやけ食いは一番太るらしいです。あーあ,なにをやけ食いしたんですか？,,,
私は見ていないのですが、戸田恵梨香さんのですか？,はい、そうです。,,,
私は元気です。あなたは,元気が人生の活力になりますね。,私も元気です。,元気なことは、良いことです。,
私は古い人間でクレジットカードか現金のみですが、なんか携帯をレジにかざしてスキャンされてる人みかけます　春菊これから鍋によさそう,私は最近クレジットカードをコンビニで使うようになりました！iD決済という不思議なものも使うようになりました。春菊は鍋に合わせると絶品ですよね！鍋と言えばなに&すか？,,,
私は古谷さんのシリーズで、中でも犬神家の一族が好きですね。,髪が汚いのが何んか合ってましたよね。私はアクション系が好きですが、アクション系は見ますか？,,,
私は喉が痛くなり始めたら「銀翹散（ぎんぎょうさん）」っていう漢方を飲むとかなり効きます！ドラッグストアでも売っています。,ぎんぎょうさん、初めて聞きました。風邪に効く漢方は葛根湯しか知らなかったので、知れて嬉しいです！,,,
私は喉痛い時は、10回以上しつこいくらいうがいします！それからのどにタオル巻いてあっためて、マスクして寝ます！,私もタオル巻いてます。寝る時はマスクもします。うがいもしました。,,,
私は幸せです,幸せなことは、素晴らしいことですね。,そうですか。,それは、良かった。,もし、役に立たないアドバイスが欲しいのなら、いつでもどうぞ！
私は硬いですが、柔軟性はあったほうがいいと思います。,なるほどー。今までで、クライミング中危ない目にあったことはありますか？高所恐怖症なので、見てるだけで怖いです。
私は行ったことは無いんですが、イチョウの木がたくさんあるところがあるらしいです。,良いですね。銀杏拾いもできますね。少し臭いけど。
私は今のところ大丈夫です。予防を万全にしています。,インフルエンザって、かかりやすい人とかかりにくい人がいるって聞きましたが、本当でしょうかね。
私は今は飼っていませんが、実家で猫を飼っています。,猫との生活も憧れますねえ。ちなみに猫ちゃんの種類はなんですか？
私は今中華鍋が欲しいです。テフロン加工のものだとどうしても駄目になってしまうので。,テフロン加工じゃない中華鍋はケアしないと錆びちゃうんじゃないですか？
私は今日は、買い物に行ったり、友達とLINEをしたりして過ごしました！,そうなんですね。だんだん寒くなってきて買い物に出るのすら億劫になる時期になってきました。
私は今日はお茶漬けを食べました。あなたは何を食べましたか？,ヘルシーですね。目玉焼きとトン汁です。
私は今日はタコスを食べました。お腹空いてないですか？,空きました！いいですね、タコス。大好きです。
私は昆布だしに、ポン酢で食べるシンプルな鍋が好きです。何鍋が好きですか？,私は味噌ベースでちゃんこっぽいお鍋が好きです。
私は最近クレジットカードをコンビニで使うようになりました！iD決済という不思議なものも使うようになりました。春菊は鍋に合わせると絶品ですよね！鍋と言えばなに&すか？,キムチ鍋が好きです　温まりますし。辛いのが好きです。ID決済って携帯使うんですか？
私は最近はドラマだとおっさんずラブにはまりました。,聞いたことはありますが見たことはありません。
私は最近始めたジャグリングの練習をするつもりです。,ジャグリング！それまたすごいですね！
私は最近電動自転車を購入したので少し遠出しようと思います。初めての電動ですので楽さに感動しています。,電動自転車って本当に快適ですよね！どれくらい時間のかかる場所にお出掛けするのですか？
私は昨日はしらたき焼きそば作りました。今日は作るのいやなので、パンですね。,しらたき焼きそば、カロリー低そうでいいですね。今日の夜はどうしようかな。いつも適当な炒め物ばかりです。
私は昨日夜中の２時に寝ました。夜は何時に寝ているんですか？,うわ！私と入れ替わりですね。寝るのは大体7時半頃ですね。
私は山頂では、見える風景を撮りますね。,夜明けで天気がいいと朝日がきれいでしょうねー。
私は山登りしたことないんですが、1時間くらいならがんばれるかな。坂道を歩き続けるってなかなか体力使いますよね！,そうですね、最初は100メートルから200メートルの山から始めたほうが楽です。,,,
私は仕事でここに来ています,どんな仕事か聞いても良いですか？,そうですか。,お仕事ですか？,
私は仕事と1日休みがあるので買い物にいきます,良いですね！なにを買いに行くのですか？,,,
私は仕事帰りに成城石井でモンブランとバスクチーズケーキを買って帰りました。,うわぁそれはいいですね最高のご褒美ですね。どちらが好きですか？,,,
私は子供のころ、小説家になりたいと思っていました。,ああ、そうなんですか。小説家って一番尊敬できる職業かもしれません。自分にとって。,,,
私は子供の頃に、毛糸でかぎ編みしたことあったのですがイライラして出来なかったのです。,母が編み物の棒？やかぎ針を持ってまして、それで棒編みを。初めてのマフラーは幅が全然揃ってなかったです。,,,
私は子供の頃は犬が飼いたいと思っていたのですが、すっかり猫派になりました。,私も同じですよ。子供の頃は犬が好きだったんですが、今は完全な猫派です。犬も好きですけどね。,,,
私は自転車の移動が多いもので、雨の影響はより受けやすいです。季節の移ろいはやっと感じられるようになりましたね。,自転車だと雨は辛いですよね。昨日、公園に行ったら銀杏の木の根元にギンナンが落ちてましたよ。,,,
私は自分で髪を切っているので美容室に行ったことがなくて、あまりわからなかったりして。,自分で切るのは難しそうですね。,,,
私は実家に帰ってゆっくりしようかなと思ってますよ。,いいですね！ゆっくり休めそうですね！,,,
私は写真ですね。最近、良いカメラを買ったんです。,いいですね！どんなものを撮影されるんですか？,,,
私は手の込んだ料理は苦手ですので、網で適当に肉や魚を焼くだけですね。料理は凝りますか？,凝りませんー！焼くだけおいしいですよね！ししゃもがこないだ美味しかったです！,,,
私は春が好きです。暖かくて過ごしやすいし、桜がきれいなので。,ああ、春もいいですね、花粉がなければ、,,,
私は春や秋の丁度良い気候が好きなので、少し寂しいですね。,同感です。夏や冬が短くて、春や秋が長くなればいいと思います。,,,
私は初心者です,何の初心者なんですか？,そうですか。,私も初心者です。,もし、役に立たないアドバイスが欲しいのなら、いつでもどうぞ！
私は少し話します,私は、話を聞くのが大好きです。,そうですか。,私で良ければお話を聞きますよ。,
私は消費税が上がっていないドラッグストアで買い物してます。,近所にあるんですか？,,,,
私は詳しくないのでわからないんですが、パノラマ撮影だとしてもあんなに長い写真はね、いらないかな～,その写真、とても興味深いんですが、巻物みたいにして保管してるんですか？壁とかに飾ってらっしゃるのですか？,,,,
私は森永のチョコパイを食べました。,チョコパイ、私も好きです,,,,
私は辛口よりも甘口のほうが好きなのですが、澤屋まつもとというのがおいしかったです。,見てみます。私もどちらかというと甘口で、フルーティーなのが好きです。獺祭とか、あと至っていうのがすごく美味しかったです。,,,,
私は成城石井でかぼちゃチーズケーキを買って，メゾンカイザーでおばけケーキを買いました。,成城石井のかぼちゃチーズケーキおいしそうですね。もう食べました？,,,,
