そうですね、私も職場で初めてイベント参加しました。,やはりそうですか。衣装は購入するのですか?
そうですね、失敗するとその日の夕食がなくなってしまいますからね。ほかにどんなものを作りますか？,他には煮物ですね。魚介が多いです。イワシやサバ、イカ、タイとか、そのときの安い食材で作ります。
そうですね、主人公は速く走れる能力を持ってます。おすすめのドラマは何かありますか？,速く走れる、なるほど。チェックしてみます！私のおすすめドラマはビッグ・リトル・ライズです。ニコールキッドマンが出演してます。
そうですね、週に一度は行きます,散歩をして健康になったという感じはしますか?
そうですね、少し安くなるようです。母親に頼まれて乗せていきました,私は配送はメルカリなどのフリマアプリで活用することが多いです。フリマアプリなどは利用されていますか？
そうですね、少し冷え込むらしいのでカラッとするかもしれません。,この前まで暑いと思っていたのに、秋を通り越して冬になっちゃいそうですね。
そうですね、食べるのが好きなので料理はよくやります。最近は鍋料理ばかりですけどね。,お話してて料理上手な感じがします～！うちも最近鍋多いです。シンプルな水炊きばかりですが！
そうですね、食欲が湧いてきます。特にカレーは食欲なくても食べれちゃいますけど。,定期的に食べたくなります、カレー。香辛料の魔力ですかね。
そうですね、心肺機能も鍛えれますし今は虫もいないので快適です。,確かに虫がいないのはうれしいですね。今週末も奈良の方にハイキング予定なので楽しみです。
そうですね、新しいアーティストを開拓したりはあまりされないんですか？,そうですねー、なんか今の人にはついて行けないというか。ミュージックステーションとかでも知らない出演者が多いです。
そうですね、人には一人も合わずに猪と出合っただけの時もあります。,すごいですね。獣に遭遇したら、どうすればいいのですか？
そうですね、世界野球も見ていました。スポーツはお好きですか？,そうなんですね。スポーツはあまり得意ではないんですが、たまに野球のチケットをもらって見に行ったりするのは楽しくて雰囲気が好きです。
そうですね、税金が高いイメージ。でも飛行機にいる時からみんなのワクワクが伝わってきますよね。,そうなんですよね。飛行機乗った時からもう気分はハワイなんですよね。一度行くとやみつきになる気持ちがわかります。
そうですね、昔は5分前精神とか言って、何でも早めに開始することが奨励されていました。,はいはい、そうですよ。私もそういう環境で育ってきたんですけどね。リビングの時計は５分早めていますよ。
そうですね、雪国なら対策できるんでしょうが、こちらではもう出たとこ勝負みたいなとこありますよね。　この前北海道に行ったのですが、もう雪がちらついてました。,北海道は9月に初雪でしたっけ？北海道に何しに行かれたのですか？
そうですね、早いとこはもうそのくらいです。妻の実家に挨拶と、義父の誕生日祝いです。,北海道までご挨拶とお祝いですか！美味しいものも食べてきたいのでしょうか？気になります。
そうですね、体が丈夫って言いますもんね。,飼っておられたことがあるんですか？お詳しいですね
そうですね、台風とか猛暑とか寒波とか忙しい国ですよね。まったく。,そうですよね。昔の日本なんて平和そのものだったのに。
そうですね、大分、嬉野とか色々ありすぎて。,別府に佐賀ですね。
そうですね、遅い時は23時くらいまでやっています。,それは朝10時に間に合うように起きるのは気合がいりますね！
そうですね、貯金と投資と温泉ですね。趣味は何ですか？,子供とゲームをすることです。
そうですね、朝晩の冷え込みが辛くなってきました。私は今東北地方に住んでいますがどのあたりにお住まいですか？,今は海外の北米地域に住んでます。ですが以前は南東北に住んでました！
そうですね、都会とか地方とか関係ないですものね。,うちは犬がいるので、避難する必要が生じても避難所に拒否されるかも知れないことが心配です。
そうですね、冬になると凍結とかあるので。,はい。私の地域は雪が少ないのですが、ものすごく凍結します。
そうですね、冬は得意ですか？,喉が弱いので乾燥する冬は苦手です。寒いのも苦手で。
そうですね、投資に興味があります。趣味は何ですか？,私は愛猫の写真を撮ることです。あとは家庭菜園もやってます。
そうですね、特に今日は冬並みに寒いですね。,私は東北地方なんですが、朝晩は暖房がないと辛いです。もう暖房つけてますか？
そうですね、読書とゲームという生粋のインドア趣味です,私もインドア派です。趣味はこれと言ってないのですが、食べることは好きです。
そうですね、鍋の種類にもよりますが、基本麺ですね。,私もラーメンが多いですねえ。ラーメン大好きなので
そうですね、南国っぽいイメージです。,南国っぽいバンドって、気になります！
そうですね、日常はほとんど何もないからですね。,何もないのも平和ということでいいですけどね。平和が一番な気がします。
そうですね、入れ替わりですね！夜型かもしれません。お仕事が朝早くからなんですか？,そうです、すぐにバイクに乗ってます。
そうですね、晩御飯は何を食べましたか？,夜は、リンゴとみかんとローソンのカプケのティラミスを食べました。
そうですね、疲れていたり睡眠不足だと免疫力落ちているので。,今年の冬は寒くなりそうですかね。,,,
そうですね、雰囲気は良いと思います。ただ私は楽天球場の観覧車に憧れますが。,あの観覧車って有名なんですか！いつも見てるばかりで乗ったことはないんですが不思議な光景ですよね。,,,
そうですね、防災ポーチに入れる防災グッズが好きです。安心できますので,使わないことが一番ですが、これは便利だろうというおススメ防災グッズはありますか？,,,
そうですね、無事だからこそ笑い話にできますね。ホームに落ちて轢かれたとかではなくてよかったです。,聞かない話でもないので気を付けたいですね。お酒を飲んだ後の終電は気を付けたいです。,,,
そうですね、面白い事とかわくわくすることが好きだなー！と思います。,明るい性格ということですね。私が最近気が付いたのは、マイナス面です。,,,
そうですね、夜は何をされる予定ですか？,夜はゲームしながらごろごろする予定です。そちらは何をする予定ですか？,,,
そうですね、揺れが心地よく感じます。各駅停車の電車とかぐっすり寝てしまいます。,それで寝過ごしてしまった失敗談もたくさんあります。後は寝ぼけて降りて転んでしまったり。,,,
そうですね、両足が固定されているの怖そうです。スポーツはあまり得意ではなくて、何か得意なものはありますか？,得意ではないですが、中学高校はバレーボールしてました。でも最近は全然運動してません。,,,
そうですね、料理と違ってちゃんと計らないと失敗しちゃいます。,最近は何を作りましたか？,,,
そうですね、料理嫌いの私としては大助かりです。,おすすめの冷凍食品はありますか？,,,
そうですね、涼しいのも嬉しいです。,散歩のしやすい良い季節です,,,
そうですね、涼しくなって運動しやすいですし、頑張りたいです。,ハーフマラソンにも挑戦しようと思ってます。追加で。,,,
そうですね、冷えますね。体調はいかがですか？,急に寒くなったので体がなかなか動きづらいです。歳かもですが。,,,
そうですね。,Yahooなどのニュースサイトは、今でもたまに見ていますか？,昔はアメリカに住んでいたので、よくNBAを観に行きました。また機会があればいきたいものです。,実際にコンサートやライブを見に行くことはありますか？,私も昔は、外に出るのがイヤな時がありましたよ。
そうですね。Amazonプライムでアクション映画を見ています。,何の映画ですか？私もプライム入っています。,,,
そうですね。Switchは色々と面白いソフトがでていて、親子で楽しんでいます。,親子で楽しめるのはいいですね。うちの子もあと2、3年もしたら欲しがりそうです。,,,
そうですね。あっという間でした。令和発表が昨日くらいに感じられます。,わかります。そう考えると、今年は結構なビックイベントありましたね～。
そうですね。あともうちょっとしっかりシリーズを見極めてからと思って。,長く使う物ですし、見極めて購入したいですよね。
そうですね。アニメや漫画見ることですね。,オススメや好きなのありますか？
そうですね。あの匂いは強烈ですね。子供の頃、近所のおうちにあって、秋になると道路にたくさん落ちてました。,でも、食べると美味しい。いやーまあまあかな。食べたことありますか？
そうですね。アンケートとか面倒だなとおもうこともありますが、楽しみながらやっています。,今度、私も今回の話を参考にしてチャレンジしてみます。
そうですね。いえ、特に予定してないです。,そうでしたか。関西在住の為、USJ付近が非常に混在する時期なって困っています。
そうですね。いちよう出しとくと安心なので。今日はどのように過ごされましたか？,今日はのんびり家で過ごしました。お昼には鍋を作りましたよ
そうですね。イベントがあるので行きたいのですが、少し遠くて躊躇してます。,なんのイベントですか？
そうですね。イングランドと南アフリカでしたっけ?,あってます。南アフリカに勝ってもらいたいなって思ってます。
そうですね。お子さんはまだ小さいんですか？,うちは５歳と１歳です。
そうですね。ガーリックトーストにしたパンを添えたりします。,ホーロー鍋が欲しくなります。
そうですね。キムチ鍋の時は必ず、ラーメンにしてます。,キムチ鍋も美味しいですよね。冬ってお鍋の日が多くなりませんか？
そうですね。ゲームはされますか？,しますよ。スマホでします
そうですね。ここ最近、冷えてきましたね。,体調はいかがですか？
そうですね。ここ最近よく映画館に行きます。,ジョーカーは観ましたか？
そうですね。こたつは出しています。,こたつですか！いいですね。こちらはだんだん紅葉が見頃になってきました。普段お休みの時なんかは何をして過ごされることが多いですか？
そうですね。こちらも気持ちい秋晴れなので、大きい物を洗濯したい気分です。,洗濯いいですね！私はお布団を干していますよ！
そうですね。このまま暖かいといいのですが。,わかります。冬が苦手なので、これから寒くなるのが恐怖です。
そうですね。ゴルフが好きです。,ゴルフとは渋いですね。ゴルフ場とか行くんですか？
そうですね。ゴルフでしょうかね。,大人の趣味ですね！まだ１度もやったことないのですが、どんな所がゴルフは面白いですか？
そうですね。これからも台風が来るかもというニュースを見たんですが、どうなのでしょうかね?,そう、ここ数年、台風が一段と大型化しているようで心配ですね。
そうですね。コンドミニアムもたくさん建って、見かけは都会風ですね。,また行ってみたいですね。おすすめの穴場があったら教えてください！
そうですね。コンビニのスイーツがお手頃価格でたまに食べます。,さっきファミマのスフレプリンティラミスカフェを食べて，おいしかったです。ローソンスイーツの方が好きですけど。
そうですね。ご自分でスイーツは作りますか？,昔週1で作っていました。今はバレンタインだけですね。
そうですね。サイクリングついでに撮影した写真の整理をしようと思います。,有意義な休日ですね。私は金曜日の夜にワイン飲み放題をしたせいで、土日はぐだぐだして終わりました。
そうですね。しかしまた見なくなってしまいそうです。,次はどのスポーツに関心がありますか？
そうですね。しかし女子は短命ですね。ザギトワとかすごく大きくなった。,そうなんですよ。大変だ。このあと、男子で羽生は余裕でしょうね。
そうですね。しかし南アフリカがとても強かったです。,最初の方はミスが多かった気がしますが、さすがに強かったですね。
そうですね。しかも使われないことも多いようで、お金も時間もかなりかけているんだなぁと。,そうだとすると、入場料とかもっと高くてもいいかもしれませんね。
そうですね。ジャンルにこだわらず何でも読みます。,そうなんですね！私も読書は好きです。最近のはあまり読めてないんですが、何か面白い本ありますか？
そうですね。スクワットと筋トレです。,運動するには良い時期ですよね。元々何かスポーツなどされていたのですか？
そうですね。ストレス発散になりますね。どんなものですか？,主に洋服です。今年はブラウンが流行りのようで茶色い服はばかり買ってしまいます。
そうですね。スナップエンドウやソラマメは地域によって秋播きか春播きか、だったりしますが、枝豆は春だったと思います。,ありがとうございます！調べてみます！自分で育てたのとか収穫したのっておいしさ倍増ですよね！
そうですね。スポーツは好きですか?,うまくはありませんが泳ぐことが好きです。スポーツは何をされますか？
そうですね。そういうものに全く興味がないので未知の世界です。,怖いですよね。うしじまくんという漫画で薬漬けの人が出てきて、怖かったのを覚えています。
そうですね。そちらはいかがでした？,こちらもとくに被害はなくて大丈夫でした。
そうですね。そちらは台風の影響はありませんでしたか？,それほどではありませんでした。風が強いのは１時間もなかったくらいです。
そうですね。ソニーのミラーレスを買いました。,どのような写真を撮られるのでしょうか？
そうですね。そのうち会社が傾くかもしれませんが、いずれ国も傾く前に避難先を考えないとですね。,昔は残業月100時間とかしていたので，今できないとなるとあの時稼いでおいてよかったと思います。
そうですね。その間にやっと電車が走るようになったという感じですね。,何年くらい住まわれているのですか？
そうですね。それこそだしの味がおいしいやつ。でもぶっかけを食べることが多いかな。,私もぶっかけ好きです。でも温かいぶっかけはあんまり。冷たいのが最高です。
そうですね。ただ後半は全然攻めれないで力の差を感じました。,今後、日本がどこまで強くなれるのか、楽しみでもありますね。
そうですね。たとえ設定はあり得なくても、自分に重ね合わせてみたりすると楽しいですよね！,今後の展開が楽しみですね～！なんだか楽しくお話出来て良かったです。
そうですね。だんだん健康が気になる年齢になってきました。,ああ、私も同じです。
そうですね。ちなみに、今飼っている猫にとっては私は兄弟ぐらいの扱いです。,そうなのですね、それはどこで決まるんですかね、子分か兄弟かというのは。
そうですね。ちなみにコーヒーはお好きですか？,ブラックは飲めないですけど。わりと。一番好きなのはラテです。
そうですね。ですから、料理のレシピっていうより見て楽しむ感じですね。,なるほど。異文化体験ができるってことですね。
そうですね。でも、ドラマでの設定は21歳なので、ちょっと厳しいなと。,そうなんですか。それは確かにちょっと厳しいかもしれませんね。でも実年齢はいくつなんですか？
そうですね。でも、去年1年間だけ以上に太っていた感じなので服はその前のものを着ています。,そうなんですね！そんなに落ちたら、減量も楽しそうですね！
そうですね。でも、食洗機を置くスペース、食洗機のお手入れが大変そうでためらってしまいます。,それはありますね。便利だけどお手入れが大変だと結局何かを我慢しなければならなくなります。
そうですね。でもスポーツ観戦は好きな方です。ラグビーはルールが分からなくて。,私もルールは分からなかったですけど楽しめました。どんなスポーツが好きですか?
そうですね。でもそれはそれでちょっと寂しいかな。,なんとなくわかります。小さい時は沢山かまくら作ったりしてました。
そうですね。でもやっぱり冷えますよね。,冬は得意ですか？
そうですね。でも高そうだし置く場所もないので難しいです。,置く場所はネックですね。たぶんランニングマシーンは月額レンタルも見たことありますが、実際には金額以外の問題も出てきますよね。
そうですね。でも私的には1枚のカードでどこの店でも使えたらいいのにと思います。,なりますよ、そういう時代に。ポイントカード何枚も持つのかさばりますもん。
そうですね。でも絶食はしないといけないと思います。,絶食は1日ですか、それとも1食だけですか。
そうですね。でも地震の心配はしないと駄目みたいです。,地震も怖いですよね。台風と違って、いつくるか分からないのは本当に不安です。
そうですね。でも例年のこの時期にしては、暖かい方なのではと思います。,確かに、そうかもしれませんね。もうタイヤ交換はしましたか？
そうですね。テレビ見ててもしょうがないですものね。分かります。,それもありますが、外で働けないので少しでも収入をという感じで。
そうですね。どうしても子供優先になってしまいますね。,パートといえばスーパーのレジ打ち、そうではないやつですか？
そうですね。ところで、映画の仕事に関わってから長いのですか？,今回が初めてです。いろいろ新鮮で楽しかったです。普段は映画はご覧になりますか。
そうですね。ところで、最近はまっているものはありますか？,色々あるんですけど、良いもの見つけたなーっていうweb漫画がありまして。
そうですね。ところで参考までにハンバーガーは日本円でいくらでしたか？,200バーツ弱ほどだったので、600円くらいでしょうか。日本で食べたら1500円くらいしてもおかしくないようなハンバーガーでした。
そうですね。どちらかと言うとミステリー系をよく読んでいる気がします。,ミステリーですか。おススメと言ってもパッと思い浮ばないものですね。あなたのおススメはありますか？
そうですね。どちらにお住まいですか？,長崎県です。どのあたりにお住まいですか？
そうですね。とはいえ、自宅でこもっていますが,私も家の掃除したり、庭仕事したりしてました。
そうですね。とはいえ小さいカメラで旅行に行くときや、飲み会の時にちょっと気軽に撮る程度ですが。,素敵です。うちの父もカメラ好きなんです。お気に入りの写真なんて、画用紙２枚分くらいの大きさにしてきますよ。
そうですね。なんか身が引き締まるような感じがしますね。,それと、食べ物がおいしいのと、外寒い状態で部屋でこたつに入ってお鍋とか、あの辺がなんともいえずで。
そうですね。なんだかお腹すいてきました。お昼は何を食べますか？,冷凍食品のカレーピラフをレンジで温めてチーズを乗せました。お手軽です！
そうですね。ネットだと好きな時間に見れますから便利ですよね。,見逃すこともありませんしね。自分の観たいタイミングで観れるので便利です。
そうですね。ネットビジネスも考えてるんですけど。,儲かる仕組みって自分では中々考え付かないので、自分でビジネスを考えているって凄いなぁと思います！
そうですね。パーツを手作りすることもあります。,手作りもするのですか。どのようにでしょうか?
そうですね。バイオリン教室で偶然出会って、あんなにステキな友達が出来たら絶対楽しいですよね！,そうですよね。なんだか見ていてワクワクしますからね！ドラマって良いですね。
そうですね。パエリアや、スパニッシュオムレツなど食べましたが、日本人好みだと思います。,食でいえば、オランダに行ったときに何にでもピーナッツソースをかけるのには辟易しました。
そうですね。バドは比較的日本勢も活躍できるスポーツだと思います。見てるとやりたくなってきますね。体操はもう辞めてしまったんですか？,本格的な体操競技はやっておりませんが、子供が新体操を習っているので、側転などの回転技などは教えたりしますよ。
そうですね。ハンドメイドでしょうか。,どんなものを作るのですか?
そうですね。フィルムの方は少なくなっていると思います。私もデジタルですね。,そうなんですね。今の季節は紅葉がいいですね。
そうですね。ホームパーティーはよくやられるんですか？,いや、たまにですね。予定が合えば、という感じです。
そうですね。ほんとは休日はどこかに旅行にいきたいんですけど、人混みが苦手なので。,そうですか。例えば、京都のような有名観光地は一年中ひとひとですが、少し季節はずれた沖縄、北海道はいいですよ
そうですね。まあ、今話題になっているあの事件ですとか。,何の事件ですか？
そうですね。まだ紅葉も本番ではないのにここまで寒いのは気持ち悪いですね。,まだ色づいてないですもんね。毎年紅葉は見に行きますか？
そうですね。むしろテリーヌに近いかも。,今、久々にテリーヌという単語を聞いて、調べました。美味しそうですねぇ。オペラとかに近い印象を持ちました。
そうですね。やっぱりオンラインショッピングは便利です。,楽天スーパーセールで10店舗買い回りとかしますが，いらないものも買ってしまってお得なのか分かりません。
そうですね。やっぱり病気になるとお金はかかるし、あとは爪とぎされて家がぼろくなります。,なるほど！やはりいろいろと余裕がないと難しい部分もあるんですねー。
