まだ早くないですか。残念ながら予定はないです。,そうですか。ところで、何か始めたいとのことですが、ジョギングとか簡単なスクワットとかいいですよ。手軽で。
まだ痩せた実感はありませんが、前よりは動きだすスピードが上がりました。掃除や家事などもスタートが速くなりました。,効果を実感しているんですね。私も運動しようと思います。
まだ北海道に行ったことがないので行ってみたいです。,名所が多いですもんね。雪まつりや海の幸、ラベンダー畑に網走刑務所、私も行きたくなりました。国内旅行も検討します。
また明日から暖かくなるみたいですけどね。,昼間はいいですけど、朝はやっぱり冷え込みますね。
まだ予定は入れてないです。そちらは、もう決められているのですか？,友達の家でワインを飲もうと言っているくらいですね。
まだ緑ですね。時間がかかりそうです,今年は紅葉が少し遅いようですね。
マツキヨってdポイントもいけるようになって便利ですね。,すごいお詳しいですね。Ｄポイントとダブルで貯まるってことですか？
マックブックプロが欲しいです,同じですね。
マツコの知らない世界とか出られそうですね。,そうですね、まつこさん相変わらず切れがあって面白いです
まったりしたいい休日ですね。私も本大好きです。エッセイとかが多いです。,エッセイですか。なんか上品ですね。私はミステリーが好きです。
まっちゃんみたいな人がいるな，とかね。私も違う楽しみ方をしました。,ああ、そうそう。話題になってますよね。
まとまった時間がないとなかなかできない作業ですよね。写真を撮られるのでしょうか？,いえ、スマホでとった写真ですが、見返すことはありませんね。
マネケン美味しいですよね。甘いものがお好きなんですか？,大好きです。スイーツお好きですか？
ママチャリしか乗ったことないし、今自転車もってないんですけど興味あって。,購入となると値段も手を出しづらいですし、比べてエコツアーならレンタルとかあるので気軽に参加できますよね。
マラソン　札幌開催になったんですよね？,そうです。札幌も十分暑いですけどね。
マラソンが北海道開催だとか、どうなるのやら。,そうですね。私は楽しみに待ってます。
マラソンは大変そう。頑張ってくださいね。,ありがとうございます。それではそろそろ。
マルチーズとシーズのミッスクです！,それは絶対可愛いですね！今、叔母がマルチーズを飼ってます。
まわりを見渡しても誰もいない時とか、無人島にいるような気分になるのが好きなんです。,そうなんですね。無になる時間も必要ですよね。
まんがなら、ラインで見てる「村井の恋」がおすすめです。,気になって検索してみました。面白そうですね！
マンチェスター・シティです。,プレミアリーグは私も好きです。
マンチェスター・シティの試合はよく見ます。,海外のチームでしょうか？
マン喫では何度かあります。下手なのでダーツバーでやる勇気はないですが。,漫画喫茶にあるのは知っててもやったこと無いという方が多いのでちょっと嬉しいです。ダーツバーはそうですね、・私も最初は怖かったです。一応ダーツもあれでスポーツっていうことになっているんですが、なにかスポーツをされてた経験はありますか？
みかん、いいなあ。幸せな時間だー。,だいたい食べきれないのでジャム祭りになるのが恒例ですね。
ミコノス島は行きました。街並みがとてもきれいでした。,そうなんですね、長い休暇が欲しいです。
ミシン高いですよね。欲しい物は、今は思い浮かばないです。,最近購入した一番高い買い物は何かありますか？
ミステリーがメインです、東野圭吾とか。,おお、面白そうですね。てか、有名ですよね。好きな方結構多いきがします。
ミステリーですか、面白そうですね。アマゾンプライムは使いやすいですか？,使いやすいと思います。が、他の動画配信サイトはまだ利用したことがないので比較したことがないんです。
ミステリーですか。おススメと言ってもパッと思い浮ばないものですね。あなたのおススメはありますか？,そうですね。個人的には湊かなえさんとか好きです。
ミステリーはドラマを観ている感じで楽なんですよ。,楽なんですか～意外な感想です！そういう読み方もあるんですね
みたいですね、とくにお子さんが小さいご家庭は予防接種必須ですね。,猫にはインフルエンザないですよね？
みどころはどのあたりですか？,笑えるところです。劇中の会話が漫才みたいな時があります。大阪制作らしいドラマです。
ミニサイズの品種の大根もあるので、それなら大丈夫だと思います。トマトもミニトマトの方が簡単ですよ。,ミニトマトすらうまくいかず、
ミニシュナさん、お顔まわりの毛のくしゃくしゃ感が好きです。うちの子はジャックラッセルテリアという犬種です。,少し後ほど調べてみます。犬種に詳しくはなくて、すみません。
ミニチュアシュナウザーっていうのと、,アメリカンコッカーっていうの飼ってました
ミニトマト、たくさんできました？私は今年の夏は黄色いミニトマトを育てましたよ。,黄色いのおいしいですよね。我が家のトマトちゃんはめぬき？がうまくいかず、大きくなりませんでした。
ミニトマトすらうまくいかず、,ぜひぜひ！ミニトマトは黄色いのとか紫色とか緑色のも育てたことありますよ。
みみちゃんです。小さいころに家にあったうさぎのぬいぐるみもみみちゃん。犬の名前は？,わ！偶然ですが、ミミちゃんです。
ミヤマキリシマというピンク色のつつじですね、平治岳（ひいじだけ）という所がすごいです。,わー！写真で見て、行って見たいなと思ってたところです！
ミュージカルがダメじゃなければおススメです。,ミュージカルはあまり好みではないのですが今予告を見て面白そうだったので見てみようと思います。
ミョウガ良いですね。竹とミントの繁殖力は凄いと聞いたことがあります。,竹だと家の方にまで根っこが来ると大変らしいですね。ミョウガは植えっぱなしで毎年食べられますよ。葉っぱも虫もほとんどつきませんし。
ミルクレープが好きですね。基本的に甘いものなら何でもいけます。,ミルクレープも美味しいですよね。お気に入りのミルクレープはありますか？
ミルクレープも美味しいですよね。お気に入りのミルクレープはありますか？,んーいろいろ食べましたが、正直スーパーで売ってるやつで満足してしまいます。
ミルフィーユ鍋美味しいですよね！豚ひき団子と白菜の鍋も美味しそう。醤油味ベースならあっさりしてますか？,割とあっさりです！豚ひき団子はこねるときに卵と生姜のしぼり汁入れて、鍋の方にも生姜の千切り入れてますよ。
みんなでまわるものだと思っていました。,そうですよ。４人です。でも、打つときは目の前のコースは自分だけのものになるんですよ。
みんなでワイワイしながらの方が楽しいですよね。ゲームをモンハンからはまったのであの感覚が懐かしいです。,モンハンはやったことがないですね。どちらかというとPS派ですか？
みんなでワイワイするのも幸せそうでいいなと思います。私は何でもない日が結婚記念日なのでお互い週単位で忘れてずれ込むことがあります。,お互い忘れているならセーフですね、片方だけ忘れてしまうと後が怖そうです。
ムキムキいいじゃないですか。やめると筋肉は元に戻るんですか。,どうなんでしょうね、ムキムキ感は若干マシになったかにも見えます。趣味ありますか
むしろ目が冴えてスッキリしますよ！モヤモヤした日の朝は行くかどうかすごく悩みますが、！,そうかぁ！動き回った後って、静かな作業に集中できるっていいますもんね！モヤモヤ、わかります！行ってしまえば楽しいのですが、行くまでが、
むずかしいですね。アヒージョってイタリアンだったかな？,アヒージョ、数年くらい前からよく聞きますね。どうでしたっけ、文字の感じはイタリアンぽいですが自信はないです。
ムニュって分かります～。知らないで触っちゃったときなんかゾゾゾと背筋が凍りますよね。,そうですよね！でも青虫は平気になったなんてスゴいです。
むほ。そーゆー生き方もありですね。私も昔たっぷり稼いで今はリタイアしたようなもんです。,そうなんですね。とりあえず10億ないと厳しいので働きまくってます
メインは団らんですよね。いつも集まれない親戚とか来たりするし。,うちもそんな感じです。お節はいつも作りますか？
メキシコ！！羨ましい！行って見たい国NO.1です。,少し遠いですが、直行便もあるし、ご飯は美味しいし、そこまで危険ではないのでぜひいらしてください。
メキシコです！標高が高いので、少し走ると息切れしてしまうんです。日本で紅葉を見ながら走りたいですね。,メキシコ！！羨ましい！行って見たい国NO.1です。
メキシコですか！それは暖かそうな地域ですね。今気温はどのくらいなんですか？,朝は10度を下回ることもあります。昼間は20度近くまで上がります。日差しが強いんです。そちらは今どれくらいの気温ですか？
メキシコですか！行ってみたい国の一つです。標高が高いとお湯が沸かないんですか？,最近テレビや雑誌で取り上げられることが増えてるみたいですよね。思っていたよりいいところですよ。標高が高いと沸点が低くなるので、湧いてるけど温度が低いんです。
メキシコ料理美味しいですよね！刺繍ものも可愛いので気になっています。,刺繍の服が安く売っているので、次々に買ってしまって大変なことになってます！でもちょっと違うデザインの可愛いのがあるとつい買ってしまいます。
メジャーなバンドのものにも行きますがインディーズが多いです。,へぇー。それじゃあ、ライブハウスとかですか？
メジャーのかただと、オリジナルラブの田島さんや、birdなどが好きです。,大人なジャンルですね、ライブハウスだと結構近くで聴けますか？
めちゃくちゃやんちゃで、甘えん坊ですよ。,Twitterにあげたりなさってます？,,
めちゃくちゃ人懐っこいんです。うちの子は猫って言うより犬っぽいかも。,へぇ！そんなに懐っこい猫もいるんですね。うちのは逆に人見知り犬見知りがひどくて大変です。,,
めちゃめちゃ面白かったですよ！,簡単なあらすじを教えてもらえますか？,,
めちゃ気になって来ました。時間あるときは何されてることが多いんですか？,後で調べてみます！うーんそうですね、私の場合は読書より漫画読んでたりしますね。,,
めっちゃ混んでるほどではないですが観光客が多いですね。でも少しましにはなってきてるそうですよ。,そうなんですね、そちらに行く予定があるのでぜひ行ってみたいと思います。,,
メニューはあるの,右上の設定から開いてね。,それは、ひ、み、つ！,何のメニューですか？
メニューを出して,右上の設定から開けます。,メニューですか？,中華のメニューでいいですか？
メニューを表示して,右上の設定から表示できます。,食堂ではありませんよ！,メニューって表示するものでしたっけ？
メモしました、今度探してみますね。,徒歩5分以内にセブン3軒ローソン1軒ファミマ1軒あるのでコンビニも毎日チェックしています。,,
メモっときます！サンドイッチの中身は定番の卵、ハムチーズ、ツナ、あと何かありますかね？,それで十分だと思います。,,
メリークリスマス,メリークリスマス,メリー・クリスマス,ホワイト・クリスマスになるかしら？
メルペイは初めて聞きました。会社によって使えるお店が違うから、なかなか難しいですよね。,本当に慣れるまで難しかったです。使われたことはありますか？,,
メンタルスポーツです。是非一度TRYしてみてください。,チャレンジしてみます！　その前に予備知識勉強と練習してから始めてみます,,
もう、何年もしてないですね。子供は大きいってか、大人なので。,趣味はございますか？,,
もう、乗りこなせますか？,すこし走るのが出来るようになってきました！けどなかなか難しいです,,
もう、半分独立してますんで。,おお、今は見たいテレビも全く見せてもらえない状況なので、そのぐらいの状態が羨ましいです。,,
もう11月も半ばですもんね。秋ももう終わっちゃいますね。,そう、ついこの前まで台風が猛威を振るってたのが嘘のようですね。,,,
もう20年くらいですね。かなり長いです。,それは長いですね！私は小さいことでイライラしてしまうんですが、そういうことってありますか？,,,
もう８年ぐらいですかね。うちは田舎なので、周りは家庭菜園してる人ばかりなんですよ。,いいですね、食べることが好きなので、自分で育てた野菜を食べられる、というのは羨ましいです。,,,
もうお子さんだいぶ大きいんですか？,もう、半分独立してますんで。,,,
もうお食事は終わられましたか？私は軽く済ませました。,はい。終わりましたよ。,,,
もうお昼は召し上がられましたか？,はい、昼ごはんはパンでした。,,,
もうご飯食べましたか？,はい、今日はすき焼きでした。,,,
もうじき年末ですものね、必要です。,ただ出してしまうとこたつから抜け出せなくなるのが難点です。,,,
もうすぐ、ハロウィンですね。何かイベント予定されていますか？,そうですね。いえ、特に予定してないです。,,,
もうすぐ、私の誕生日なの！,まぁ、おめでとうございます。,おめでとう。何かプレゼントを準備していきますね。,あら、おめでとう。いつなの？,
もうすぐ10年なんですね。何か特別なこと計画されていますか？,世間ではスイート10なんて言葉もありますが、うちは特にはないですね。例年と同じだと思います。,,,
もうすぐ食べようかと思っています。,朝は時間がないからササっと済ませたいですよね。,,,
もうだいぶ冬って感じですね。,空気とか、暖房のにおいが、冬って感じです！,,,
もうちょっとみたいですね。多少冷え込まないと映えませんからね。,やっぱり温かい分遅めなんですね。東北の南は徐々に始まってきてます。11月末から12月くらいまでですかね。,,,
もう一つ持っていますか,はい、持っています。,いいえ、持っていません。,どうでしょうか？,もうひとつですか？
もう一度言ってくれますか,はい、分かりました。,えっ、なんですって。,もう一度ですか？,その話、後でも良いかしら？私がおばあちゃんになってからでも？
もう結成して１０年？以上なのですね。どうも疎くて。,いえ、興味がなかったら知らないですよね。デビューまでの下積み時代が長かったんです。,,
もう見ているかと思いますが、ドーンオブザデッドは面白かったです。,いや、見ていないですね。ありがとうございます、見てみます。,,
もう自ら誕生日だなんて言わないですもん。,そうですか、そうなりますよね！私も、誕生日はスルーしてますよ、とっくに。,,
もう拾っちゃったから、どうしようもなかったってのもありますね。手を出しちゃったからしょうがないっていうか。,それでもそこまで出来る方はなかなかいないと思いますよ、素晴らしい事だと思います。,,
もう終わってしまいましたがあなたの番ですは見てました。今は何となくG線上のあなたと私とか見てますね。,あなたの番です面白かったですよね！G線上のあなたと私も見てます。3人の関係性が面白いですよね。,,
もう小旅行ですね。県超えてしまったら笑うしかないですね。,駅を出たら終電を乗り過ごして到着した人を捕まえにきた旅館の営業があるみたいです。ある意味助かりますね。,,
もう少しで今年も終わりますね。年々、１年過ぎるのが早く感じるようになってきてます。,同感です。来年は１日多いですけどね。うるう年だから。,,
もう少しゆっくり話してください,はい、分かりました。,ゆっくりですか？,スピード調整できましたっけ？
もう少し南の、メキシコになります。標高が高いのでパスタが上手く茹でられないんですよ。,メキシコですか！行ってみたい国の一つです。標高が高いとお湯が沸かないんですか？,,
もう食べました。朝食はパン派ですか？ご飯派ですか？,パン派です。菓子パンか食パンを食べてます。何派ですか？,,
もう朝ごはんはたべましたか？,いえ、これからです。あなたは食べましたか？,,
もう冬支度なにかなさいました？私はこれからです。,はい、２，3日前にしました。急いで。,,
もう晩御飯は召し上がられました？,はい、そちらは食べられました？,,
もう服も寝具も冬用ですか。,冬用ですね。でも真冬ならそれにフリースなど重ね着していきます。,,
もう夕食は食べました？,はい！食べました！,,
もう夕食は食べられましたか？,いえ。これからです。,,
もう来ないでほしいんですがね、今年は本当に台風が多くて参りましたね。,１０月だというのに半そでで過ごせるというのもおかしいですよね。,,,
もう良い歳した大人ですが、直らないので諦めてます。,いいですよ、ここにもいますから。いいんですよ、それでも間に合えば。,,,
もし１週間とかの休みがあるなら、どこに行きたいですか？,沖縄に行きたいです！,,,
もしお時間があれば足を運んでみてください。,はい、教えていただきありがとうございます。,,,
もしかして、辛いのも好きですか？,ん～、そこまで辛すぎるのは無理ですけど、まぁまぁ辛いのも好きです！,,,
もしかしてそうかな、と思っていましたよ。アメリカかヨーロッパあたりですか？,するどいですね！場所はタイのバンコクです。国際的な都市なのでいろんな国の食べ物があります。,,,
もしかしてラーメン好きですか？,大好きです。あなたもお好きですか？,,,
もしかして筋トレとか、糖質制限とかされていたり？,週一でジムで筋トレしています。何か運動されていますか？,,,
もしかして新聞配達のお仕事ですか？,ピンポンです。,,,
もしもの話をしていいですか？,もしで始まる話は嫌いよ。,それって、仮定の話だよね？,話を聞くだけよ。アドバイスは出来ないからね。,その話、後でも良いかしら？私がおばあちゃんになってからでも？
モスバーガー他のファストフード店より提供遅いですよね？,注文されてから作りますからねー。早くつくるようにがんばってはいますが。,,,
もたまに見ますが、主にW杯です。,私もA代表がメインでみてます。オリンピックよりWカップですね。,,,
もちろん,そうですね。,そうですか。,もちろんですね。,
もちろん！私は大好きですよ。茶わん蒸しとかにも入ってますよね。,あっ、そうだった。忘れてましたよ。,,,
もちろん、ラーメンライス基本です！調子が良ければ、替え玉まで。,すごい！私もラーメンライス好きなんですが、量食べられないので半ラーメンと小ライスです。,,,
もちろんです、最後の楽しみですからね！,しめのうどんが、本当に美味しいですよね！,,,
もちろんです。肉より魚派です。,釣りとかも好きだったりしますか？,,,
もちろんです。遊びに行くときも、おにぎり持っていきます。,買うよりおいしいんでしょうね。おにぎりなんてコンビニのしか食べたことない。トウモロコシを作っているのは珍しいですね。,,,
もちろん嫌ですが、大麻はまだかわいいもののような気がします。彼女は覚せい剤もですか？,ニュースでは覚せい剤の報道はされていないようですね。,,,
もったいない。私はあらゆるポイントをためています。,あっ！マツキヨポイントは貯めてます。サプリをまとめて買うので。,,,
モッチャムが一番お気に入りです。ドリンクより，タピオカ自体がいい。,へー！今度飲んでみます。モッチャム！,,,
モッチャム東京にも進出したみたい。,そうなんだ！私は鹿のマークのタピオカ屋さんのが1番美味しかったです！なんだったかな、,,,
もってます！あれはすっごいあったかい。紐で縛るタイプでした。,いいなぁ。電気を使わずに暖かくなるグッズはいいですね。関係ないけどうどんのふとんもほしい。,,,
もってますよー。時々フェリーで向かってます。,フェリーで車移動はなかなか時間がかかりますが、自家用車で移動できるところはいいですよね。最近宮崎へいく時は飛行機ばかりになってしまっています。ドライブ以外に趣味などはあり,,,
もっと練習しなければいけません,そうですね。,そうですか。,練習ですか？,あなたとは、分かり合えないわ！
もっぱら、近所にある中華屋の味噌ラーメンですね。ラーメン以外はパスタですかね！,冬は味噌いいですね。パスタは何がお好きですか？,,,
モツ鍋いいですね。仕事で九州で勤務していた時、よく食べました。,本場ですね。やはり他で食べるのとは違いますか。,,,
もともとウクレレを弾いてましたが、新たにウクレレメンバーが増えたので私がベースになりました。,ウクレレも弾けるんですね。女子の曲は最近あいみょんしかないですね。,,,
もともと運動は好きではないのですが、ヨガは気持ちよく取り組めます。,私もあまり運動は好きではありませんが、ヨガにはちょっと興味がわきました。,,,
もともと弱いので、毎日マヌカハニーを食べてます。それでも痛くなったら、イソジンをして、飴をなめながら寝ます。,すごい対策してるんですね。イソジンは私も持ってた気がするので、使ってみます。,,,
もともと主婦だったので融通は利きます。切迫早産は絶対安静なので大変ですねっ,主婦、・あこがれます。ぐーたらなので仕事したくない。主婦も大変ですけどね。,,,
もともと少しコスプレ衣装を持っているので、使い回しです。本当はレンタルとかあればいいのですけれど,コスプレ衣装あるなら、ハロウィンは嬉しい機会ではないのですか?,,,
